Diseases name,Category,Question,Answer
Brown spot Grain,Causes/Risk Factor,Do nutrient-deficient leaves act as infection sites?,Yes  nutrient-deficient leaves act as prime infection sites for brown spot. Leaves lacking essential nutrients  especially potassium and silicon  have weaker cell walls and compromised physiological defenses. This makes them highly susceptible to penetration by *Bipolaris oryzae* spores. The fungus can establish and spread more easily on such weakened tissue  leading to larger and more numerous lesions.
Brown spot Grain,Causes/Risk Factor,Is the pathogen stronger in old seeds?,Yes  the brown spot pathogen can be stronger or more prevalent in old seeds  particularly if they were harvested from an infected crop and not properly stored. Older seeds may have a higher fungal load from the previous season. Additionally  the viability and vigor of old seeds themselves can be reduced  making the resulting seedlings weaker and more susceptible to infection from the seed-borne pathogen.
Brown spot Grain,Treatment,Which fungicides are effective for brown spot control?,Several fungicides are effective for brown spot control. Common active ingredients include propiconazole  azoxystrobin  tricyclazole  and carbendazim. These systemic fungicides are absorbed by the plant and provide protective and curative action. Strobilurin-based fungicides (like azoxystrobin) and triazole-based fungicides (like propiconazole) are widely used for their broad-spectrum activity against *Bipolaris oryzae*.
Brown spot Grain,Treatment,Can Tricyclazole control brown spot in grains?,While Tricyclazole is highly effective against rice blast disease  its efficacy against brown spot (*Bipolaris oryzae*) is limited. Tricyclazole primarily targets the melanin biosynthesis pathway specific to *Magnaporthe oryzae* (rice blast fungus). For brown spot  fungicides with a broader spectrum of activity  such as those containing propiconazole  azoxystrobin  or carbendazim  are generally recommended and more effective.
Brown spot Grain,Treatment,How often should I spray fungicides for brown spot management?,The frequency of fungicide spraying for brown spot management depends on disease severity  prevailing weather conditions  and the specific fungicide's residual activity. Typically  1-2 applications might be sufficient for moderate pressure. Sprays are often recommended at critical growth stages like late tillering  booting  and flowering. Always follow label instructions for specific fungicides regarding re-application intervals and maximum number of sprays to avoid resistance.
Brown spot Grain,Treatment,Are there any organic fungicides available for brown spot?,Yes  some organic options can help manage brown spot  though they may have varying efficacy compared to conventional fungicides. Neem extract  copper-based formulations (e.g.  Bordeaux mixture)  and some biological control agents (like *Trichoderma* species or *Bacillus subtilis*) can be considered. These typically act as protectants or enhance plant resistance. Integrated approaches combining these with cultural practices are often more effective in organic systems.
Brown spot Grain,Treatment,Can neem extract be used to treat brown spot?,Neem extract can be used as a natural  organic option to help manage brown spot  but its efficacy is generally more protective and suppressive rather than curative. Neem oil and its compounds have antifungal properties that can inhibit spore germination and fungal growth. It acts as a preventative measure or helps reduce disease severity in mild cases  often needing repeated applications. It's best used as part of an integrated pest management (IPM) strategy.
Brown spot Grain,Treatment,Is seed treatment effective for brown spot prevention?,Yes  seed treatment is highly effective and a crucial step for brown spot prevention. Since *Bipolaris oryzae* is seed-borne  treating seeds with appropriate fungicides (e.g.  carbendazim  thiram  or combination products) before sowing eliminates or significantly reduces the primary inoculum source. This protects seedlings from early infection  ensures better germination  and minimizes the initial spread of the disease in the field.
Brown spot Grain,Treatment,Should I use copper-based fungicides for brown spot?,Copper-based fungicides (like copper oxychloride or Bordeaux mixture) can have some efficacy against brown spot as they are broad-spectrum contact fungicides. They provide a protective barrier on plant surfaces. However  they are generally less effective than modern systemic fungicides against established brown spot infections and may require frequent applications. They are often preferred in organic farming or as part of an integrated approach where systemic options are limited.
Brown spot Grain,Treatment,Can bio-control agents reduce brown spot infection?,Yes  bio-control agents can help reduce brown spot infection. Microorganisms like *Trichoderma* species  *Pseudomonas fluorescens*  or *Bacillus subtilis* can act as antagonists to *Bipolaris oryzae*. They work by producing antifungal compounds  competing for nutrients and space  or inducing systemic resistance in rice plants. While they might not provide complete eradication  they can significantly suppress disease development and are valuable components of integrated pest management (IPM).
Brown spot Grain,Treatment,Does baking soda spray work for brown spot control?,Baking soda (sodium bicarbonate) sprays can have some fungistatic properties and might offer a limited degree of control for certain foliar fungal diseases. However  its effectiveness against brown spot  particularly on rice grains  is generally considered low compared to conventional fungicides or even stronger organic options. It might provide some very mild suppressive effect in early  very minor infections  but it's not a reliable primary treatment for brown spot.
Brown spot Grain,Treatment,Should I treat infected fields immediately after detection?,Yes  treating infected fields immediately after brown spot detection is crucial for effective management. Early intervention can prevent the disease from spreading rapidly and becoming severe  especially during critical growth stages like booting and flowering. Timely application of recommended fungicides can limit further damage to leaves and developing grains  thereby minimizing yield and quality losses. Delaying treatment often leads to more extensive damage and reduced efficacy.
Brown spot Grain,Treatment,Can changing irrigation schedule help manage brown spot?,Yes  changing the irrigation schedule can help manage brown spot. Avoiding prolonged periods of leaf wetness and high humidity within the crop canopy is key. This means irrigating in the morning rather than late afternoon or evening  allowing foliage to dry before nightfall. Optimizing water levels and ensuring good drainage can also reduce plant stress and create a less favorable environment for fungal proliferation.
Brown spot Grain,Treatment,How many applications are needed for full control?,The number of fungicide applications needed for full control of brown spot varies depending on the severity of the disease  weather conditions  the specific fungicide used  and the rice variety's susceptibility. Typically  1-3 applications might be recommended. Often  one application at the booting stage and another at flowering or early grain filling is suggested. Always consult local agricultural advisories and fungicide label instructions for precise recommendations tailored to your region.
Brown spot Grain,Treatment,Are there cost-effective fungicides for small farmers?,Yes  there are often cost-effective fungicide options for small farmers  though prices vary by region and active ingredient. Older  generic fungicides with active ingredients like carbendazim or mancozeb can be more affordable. Some systemic options like propiconazole are also relatively cost-effective. Small farmers should seek advice from local extension services to identify the most economical and effective fungicides available in their area  considering the disease pressure and budget.
Brown spot Grain,Treatment,Should I mix fertilizers with fungicides while spraying?,Mixing fertilizers with fungicides while spraying (tank mixing) can sometimes be done  but it requires careful consideration. It can save labor and application costs. However  you must ensure chemical compatibility to avoid phytotoxicity (plant damage) or reduced efficacy of either product. Always consult product labels for compatibility information and conduct a small-scale jar test before mixing large batches. It's generally safer to apply them separately unless specifically recommended.
Brown spot Grain,Treatment,Is foliar spraying enough to treat brown spot?,Foliar spraying is a primary method to treat brown spot  and it is often sufficient  especially when applied protectively or at the early stages of infection. Systemic fungicides applied as foliar sprays are absorbed by the plant and provide both protective and curative action. However  for comprehensive control  foliar spraying should be integrated with other management practices like seed treatment  proper nutrient management  and field sanitation.
Brown spot Grain,Treatment,Can hot water seed treatment reduce infection?,Yes  hot water seed treatment can be an effective non-chemical method to reduce brown spot infection  particularly for seed-borne pathogens. Soaking seeds in hot water (e.g.  50-55°C for 10-20 minutes  depending on the crop and pathogen) can kill fungal spores on or within the seed without harming the embryo. However  precise temperature and timing are critical to ensure efficacy and avoid damaging seed viability.
Brown spot Grain,Treatment,Should I remove infected plants after spraying?,Removing infected plants after spraying fungicides for brown spot is generally not a common practice  especially in large rice fields  as fungicides are designed to protect and treat the existing plants. However  in small  localized outbreaks or when dealing with highly diseased individual plants  removing severely infected plants could help reduce the inoculum load. This is more feasible as a sanitation measure before or early in the season  rather than post-spray in a mature crop.
Brown spot Grain,Treatment,Are drones used for brown spot spraying?,Yes  drones are increasingly being used for brown spot spraying in large rice fields. Drone technology offers several advantages: precise and uniform application  reduced water usage  minimized soil compaction  and the ability to spray difficult-to-access areas. This targeted application can improve fungicide efficacy and efficiency  making it a valuable tool for modern brown spot management  especially for larger commercial operations.
Brown spot Grain,Treatment,How can I test fungicide effectiveness in my field?,To test fungicide effectiveness in your field  establish small  replicated test plots. Apply the fungicide to one set of plots and leave another set as an untreated control. Monitor disease development (lesion number/size) and severity over time in both treated and untreated plots. At harvest  compare yield and grain quality parameters (e.g.  percentage of discolored grains) between the two sets. This comparative approach helps assess the fungicide's impact.
Brown spot Grain,Treatment,Does alternating fungicides help prevent resistance?,Yes  alternating fungicides or using fungicide mixtures with different modes of action is a crucial strategy to prevent the development of fungicide resistance in the brown spot pathogen (*Bipolaris oryzae*). Repeated use of a single fungicide can select for resistant fungal strains. By rotating active ingredients  the pressure on the fungal population is diversified  reducing the likelihood of resistance evolving and maintaining the long-term effectiveness of available treatments.
Brown spot Grain,Treatment,Are systemic fungicides better than contact ones for brown spot?,Systemic fungicides are generally considered better than contact fungicides for brown spot control. Systemic fungicides are absorbed by the plant and translocated throughout its tissues  offering both protective and curative action against the *Bipolaris oryzae* fungus. Contact fungicides  on the other hand  only protect the surface where they are applied and can be washed off by rain  requiring more frequent applications. Systemic options provide more robust and longer-lasting control.
Brown spot Grain,Treatment,Can rice be saved if infection occurs before flowering?,If brown spot infection occurs before flowering  rice can still be saved  but immediate and effective management is crucial. Early infection primarily affects leaves  reducing photosynthetic capacity. Timely application of fungicides and proper nutrient management (especially potassium and silicon) can protect the plant  enable it to recover  and minimize further spread to the developing panicles  thereby mitigating significant yield loss during the critical grain filling stages.
Brown spot Grain,Treatment,Should I stop irrigation before applying fungicide?,You generally do not need to stop irrigation before applying fungicides for brown spot  especially if using systemic products. In fact  maintaining adequate soil moisture can help the plant absorb systemic fungicides more effectively. However  avoid over-irrigation that causes standing water or excessive leaf wetness immediately after application  as this might wash off contact fungicides before they can adhere or dilute systemic ones. Always check specific fungicide label instructions.
Brown spot Grain,Treatment,Can plant growth promoters reduce brown spot damage?,Plant growth promoters (PGPs) can indirectly reduce brown spot damage by enhancing overall plant health and vigor. By improving root development  nutrient uptake  and stress tolerance  PGPs can strengthen the rice plant's natural defense mechanisms  making it more resilient to *Bipolaris oryzae* infection. While not direct fungicides  healthier plants are better equipped to resist or recover from disease  thus mitigating potential damage.
Brown spot Grain,Treatment,Is manual removal of infected panicles effective?,Manual removal of infected panicles for brown spot control is generally not practical or effective in large rice fields. Brown spot often affects numerous panicles and leaves  making manual removal labor-intensive and inefficient. It might be marginally useful in very small  localized patches or for seed production plots if done meticulously and very early  but it's not a standard or recommended control method for widespread brown spot.
Brown spot Grain,Treatment,Does lime application help in recovery from brown spot?,Lime application can indirectly help in recovery from brown spot  particularly in acidic soils. Brown spot is often more severe in low pH soils where nutrient deficiencies (like phosphorus  potassium  and silicon) are common. Liming raises soil pH  improving nutrient availability and creating a healthier growing environment for rice plants. This enhanced plant vigor and nutrient uptake can improve the plant's natural resistance and aid in recovery.
Brown spot Grain,Treatment,Are there any natural predators of the brown spot fungus?,No  there are no known natural predators of the brown spot fungus (*Bipolaris oryzae*) in the way that insects prey on other insects. Brown spot is a fungal disease  and its natural antagonists would typically be other microorganisms (like beneficial bacteria or other fungi  e.g.  *Trichoderma* species) that compete with it or produce inhibitory compounds. These are referred to as biological control agents  not predators.
Brown spot Grain,Treatment,Can fermented plant extracts control the fungus?,Fermented plant extracts (FPEs) can sometimes offer a degree of control against fungal pathogens due to their content of beneficial microbes and plant-derived compounds with antifungal properties. While specific efficacy against brown spot would depend on the extract's composition and method  some FPEs can enhance plant immunity or directly suppress fungal growth. They are typically used in organic systems as part of a broader IPM strategy  requiring consistent application.
Brown spot Grain,Treatment,Is it possible to suppress brown spot using compost tea?,Yes  it is possible to suppress brown spot using compost tea  particularly as a prophylactic or early intervention measure in organic systems. Compost tea is rich in beneficial microorganisms that can compete with pathogenic fungi  produce antifungal compounds  or induce systemic resistance in plants. Regular applications can improve plant health and create an unfavorable microbial environment for *Bipolaris oryzae*  thereby suppressing disease development.
Brown spot Grain,Treatment,Can proper drying reduce post-harvest infection?,Yes  proper drying is crucial to reduce post-harvest infection and further development of brown spot. The fungus *Bipolaris oryzae* requires moisture to thrive. If rice grains are dried immediately and thoroughly to a safe moisture content (typically below 14% for storage)  the fungal activity is halted  preventing any further spread or deterioration of infected grains during storage.
Brown spot Grain,Treatment,Do local agricultural offices provide treatment help?,Yes  local agricultural offices  extension services  and research institutions are excellent resources for providing treatment help for brown spot. They offer science-based advice on disease identification  recommended fungicides  appropriate application timings  cultural practices  and integrated pest management strategies tailored to local conditions. Farmers should actively consult these offices for up-to-date and context-specific guidance.
Brown spot Grain,Treatment,Can resistant rice strains recover after early infection?,Resistant rice strains have genetic mechanisms to tolerate or fight off infection more effectively. If a resistant strain experiences an early brown spot infection  it has a much higher chance of recovering and minimizing damage compared to a susceptible strain. Its inherent defenses help to contain the pathogen  reduce lesion development  and maintain overall plant health  allowing for better yield and quality recovery.
Brown spot Grain,Treatment,Is there a government-subsidized fungicide for brown spot?,The availability of government-subsidized fungicides for brown spot varies significantly by country  region  and specific agricultural policies. In some areas  governments may offer subsidies on certain pesticides or provide them at reduced costs to support farmers in managing economically significant diseases like brown spot. Farmers should check with their local agricultural departments or extension services to inquire about such programs.
Brown spot Grain,Treatment,Can intercropping reduce the spread of brown spot?,Intercropping can potentially reduce the spread of brown spot  but its efficacy depends on the specific companion crops and arrangement. A non-host intercrop can create a physical barrier  alter the microclimate (e.g.  reduce humidity or modify light)  or enhance biodiversity  thereby making the environment less conducive for brown spot pathogen spread and infection on the rice plants. However  this is not a primary control method.
Brown spot Grain,Treatment,Do farmers need to repeat fungicide treatment every year?,Whether farmers need to repeat fungicide treatment every year for brown spot depends on several factors: the prevalence of the disease in the area  the susceptibility of the rice variety planted  previous season's inoculum load  and prevailing weather conditions. If brown spot is a perennial problem and conditions are favorable  annual treatment (or at least robust preventative measures) is usually necessary to protect the crop.
Brown spot Grain,Treatment,Can field burning eliminate brown spot spores?,Field burning  if done effectively and completely  can eliminate a significant portion of brown spot spores and infected crop residues from the soil surface  thereby reducing the primary inoculum source for the next season. However  burning has environmental drawbacks (air pollution  loss of organic matter) and may not eradicate all deep-seated spores. It's often considered a drastic measure and its use varies by region and policy.
Brown spot Grain,Treatment,Is irrigation with clean water enough for mild infection?,No  irrigation with clean water alone is generally not enough to treat or resolve a mild brown spot infection. While good water quality is important for plant health  brown spot is a fungal disease requiring specific fungicidal action or robust preventative measures. Clean water will not eliminate the existing fungal pathogen or prevent its spread if other environmental conditions remain favorable for the disease.
Brown spot Grain,Treatment,Can combining biofertilizers and fungicides be effective?,Yes  combining biofertilizers and fungicides can be an effective integrated approach. Biofertilizers enhance plant health and vigor  improving natural resistance  while fungicides provide direct control against the pathogen. This synergistic strategy can lead to better disease management by strengthening the plant's ability to withstand infection while also directly targeting the fungus  potentially reducing the overall reliance on chemical inputs over time.
Brown spot Grain,Treatment,Does pruning of infected leaves reduce infection spread?,Pruning of infected leaves can theoretically reduce brown spot infection spread by removing initial inoculum sources. However  in large rice fields  manual pruning is highly impractical and labor-intensive. It's more feasible in small-scale or nursery settings. For mature rice crops  foliar fungicide applications are the more practical and effective method to manage widespread leaf infections and prevent further spread.
Brown spot Grain,Treatment,Is early harvesting advisable in infected fields?,Early harvesting in severely brown spot-infected fields can sometimes be a strategic decision  but it's a trade-off. It might prevent further deterioration of grain quality and reduce shattering losses if the disease is rapidly progressing. However  harvesting too early means the grains might not have reached physiological maturity  leading to lower yields and poorer milling quality. The decision requires careful assessment of disease severity versus grain maturity.
Brown spot Grain,Treatment,Can I make home-based antifungal spray safely?,Making home-based antifungal sprays safely for rice fields is generally not recommended for brown spot control. While some natural ingredients like garlic  chili  or certain herbs have fungicidal properties  their efficacy against a serious disease like brown spot in a field setting is often inconsistent and unproven. Furthermore  improper formulation or application can be ineffective or even harmful to plants or the environment. It's better to rely on tested and approved products or expert advice.
Brown spot Grain,Treatment,Does spraying time (morning/evening) affect effectiveness?,Yes  spraying time (morning/evening) can affect fungicide effectiveness for brown spot. Early morning or late afternoon/evening are generally preferred. Spraying in the morning after dew has evaporated but before high temperatures and winds set in allows for better fungicide absorption and reduced drift. Evening applications can also be effective as they avoid harsh midday conditions  allowing the fungicide to remain on the plant longer. Avoid spraying during strong winds or impending rain.
Brown spot Grain,Treatment,Are there safe treatments for organic-certified rice farms?,Yes  there are safe treatments for organic-certified rice farms to manage brown spot. These typically include: 1. Cultural practices (resistant varieties  proper nutrition  field sanitation). 2. Biological control agents (e.g.  *Trichoderma* spp.  *Bacillus subtilis*). 3. Organic fungicides like neem extracts  copper-based formulations (used cautiously). 4. Fermented plant extracts or compost teas. The focus is on prevention and strengthening plant immunity within organic farming principles.
Brown spot Grain,Treatment,Do resistant varieties still need chemical treatment?,Resistant varieties generally have a higher inherent ability to withstand brown spot infection  often reducing the need for chemical treatment. However  under high disease pressure  extremely favorable environmental conditions for the fungus  or if grown in suboptimal soil  even resistant varieties can show some symptoms. In such cases  a minimal application of chemical treatment might be warranted to protect yield  especially at critical growth stages  to supplement their natural resistance.
Brown spot Grain,Treatment,Can foliar feeding with micronutrients reduce infection?,Foliar feeding with micronutrients  especially silicon  can help reduce brown spot infection. Silicon strengthens plant cell walls  making them more resistant to fungal penetration and enhancing overall plant defense. Other balanced micronutrients ensure the plant is robust and healthy  thereby improving its natural immunity against the *Bipolaris oryzae* fungus. While not a direct fungicide  it can significantly boost the plant's ability to resist disease.
Brown spot Grain,Treatment,Does crop rotation help treat recurring infections?,Crop rotation is not a direct treatment for an ongoing brown spot infection  but it is a highly effective preventative and long-term management strategy for recurring infections. By rotating rice with non-host crops  the inoculum load of *Bipolaris oryzae* in the soil is significantly reduced over time  breaking the disease cycle and diminishing the chances of severe recurring outbreaks in subsequent rice crops.
