Diseases name,Category,Question,Answer
Brown spot Grain,Symptoms,What are the first signs of brown spot disease on rice grains?,The first signs of brown spot disease on rice grains typically appear as small  pinpoint brown or dark spots on the glumes  which are the outer coverings of the grain. These spots can be circular or oval  and they may initially be scattered. As the disease progresses  these spots enlarge  often coalescing to form larger  irregular patches. The color can intensify to dark brown or even black  and a yellowish halo might sometimes be visible around the lesions  indicating active fungal growth.
Brown spot Grain,Symptoms,How can I differentiate brown spot from other grain discolorations?,Differentiating brown spot from other grain discolorations involves observing specific characteristics. Brown spot lesions are typically dark brown to black  often with a distinct margin  and can be circular or oval  sometimes with a yellowish halo. Other discolorations might be due to nutrient deficiencies (often leading to overall yellowing or bronzing)  other fungal diseases (like false smut which creates powdery green masses)  or insect damage (which might leave holes or irregular feeding marks). A magnifying glass can help examine the lesion morphology for clearer identification.
Brown spot Grain,Symptoms,Do brown spots appear on leaves or only on grains?,Brown spots appear on both leaves and grains. While the name brown spot grain specifically refers to the infection on the rice grains  the disease  caused by the fungus *Bipolaris oryzae*  also manifests prominently on the leaves. On leaves  it causes numerous small  oval to circular dark brown spots with a yellowish halo. These leaf spots can enlarge and coalesce  leading to severe blighting. The presence of these characteristic spots on both parts of the plant helps in confirming the diagnosis.
Brown spot Grain,Symptoms,What color changes occur when brown spot infects the rice grain?,When brown spot infects the rice grain  distinct color changes occur. Initially  tiny  dark brown to black spots appear on the glumes. These spots gradually enlarge and deepen in color  becoming intensely dark brown or black. The affected areas might also exhibit a slightly sunken appearance. In severe cases  the entire grain or significant portions of it can turn dark  giving a charcoal-like appearance. Sometimes  a reddish-brown hue can be observed in the early stages  progressing to the characteristic dark brown.
Brown spot Grain,Symptoms,Are the spots circular or irregular in shape?,The spots caused by brown spot disease on rice grains can be both circular and irregular in shape. Initially  they often appear as small  distinct circular or oval spots on the glumes. However  as the infection progresses and multiple lesions coalesce  they can merge and form larger  more irregular patches. These merged lesions lose their original distinct circular outline  creating broader areas of discoloration. The shape can also vary slightly depending on the rice variety and environmental conditions.
Brown spot Grain,Symptoms,Does brown spot cause the grain to shrink or crack?,Yes  brown spot can cause the grain to shrink and  in severe cases  even crack. The fungal infection damages the developing grain  leading to poor grain filling. This results in shrunken  shriveled  or lighter-weight grains. The structural integrity of the grain can also be compromised  making it more brittle and susceptible to cracking  especially during drying and milling processes. This shrinkage and cracking significantly reduce both the quality and market value of the harvested rice.
Brown spot Grain,Symptoms,Can brown spot infection be detected before harvesting?,Yes  brown spot infection can be detected before harvesting. The symptoms are visible on both the leaves and the developing grains in the field. On leaves  characteristic brown  oval spots appear  which can be an early indicator. On the panicles  symptoms are noticeable on the glumes as dark brown to black spots on individual grains during the milk to dough stages. Regular field scouting and close inspection of the maturing panicles can reveal the presence and severity of the disease prior to harvest.
Brown spot Grain,Symptoms,Does brown spot make the grains lighter or darker in color?,Brown spot makes the grains darker in color. The characteristic symptom on the glumes is the appearance of dark brown to black spots. These spots coalesce and cover larger areas  giving the infected grains a distinctly darker  often charcoal-like  appearance compared to healthy grains. While the grains may become lighter in weight due to poor filling  their external color certainly darkens significantly due to the fungal lesions.
Brown spot Grain,Symptoms,What part of the grain is most affected by brown spot?,The glumes  which are the protective outer coverings of the rice grain (lemma and palea)  are the most visibly affected part by brown spot. The characteristic dark brown to black lesions appear directly on these glumes. While the fungus can penetrate and affect the inner kernel  leading to poor grain filling and discoloration of the embryo  the primary and most evident symptoms are seen on the external surface of the glumes.
Brown spot Grain,Symptoms,Do affected grains have any odor change?,Generally  affected grains with brown spot do not exhibit a distinct or noticeable odor change. The primary impact is visual discoloration and physical degradation (shrinkage  brittleness). Unlike some bacterial or other fungal diseases that might produce a foul or moldy smell  brown spot  caused by *Bipolaris oryzae*  primarily affects the grain's appearance and internal quality without imparting a significant change in odor that is easily detectable in the field or during storage.
Brown spot Grain,Symptoms,How can I tell if my rice discoloration is from a nutrient deficiency or brown spot?,To differentiate between nutrient deficiency and brown spot discoloration  observe the pattern and nature of the symptoms. Nutrient deficiencies typically cause uniform yellowing  bronzing  or purpling across entire leaves or large sections of the plant  often without distinct spots. Brown spot  conversely  causes specific  localized dark brown to black spots with defined margins and sometimes a yellow halo on leaves and grains. These spots are characteristic fungal lesions  distinct from general nutrient-related discoloration.
Brown spot Grain,Symptoms,Do brown spot lesions increase after rainfall?,Yes  brown spot lesions tend to increase and worsen after periods of rainfall. High humidity and prolonged leaf wetness  often associated with rainfall  create highly favorable conditions for the *Bipolaris oryzae* fungus to spread and infect. The spores are readily dispersed by splashing rain  and the moisture allows for optimal germination and penetration into plant tissues. Therefore  outbreaks and severity of brown spot often intensify following rainy weather.
Brown spot Grain,Symptoms,Does brown spot cause any sticky or powdery texture on grains?,No  brown spot typically does not cause a sticky or powdery texture on grains. The disease primarily manifests as dark  sunken lesions on the glumes  leading to discoloration and poor grain filling. If you observe a powdery  sooty  or sticky texture  it's more likely an indication of other fungal diseases like sooty molds (which are secondary) or false smut (which produces powdery green or yellow spore masses). Brown spot lesions are generally dry and firm.
Brown spot Grain,Symptoms,Can I detect brown spot using a magnifying glass in the field?,Yes  you can certainly detect brown spot using a magnifying glass in the field. A magnifying glass helps in clearly observing the characteristic features of the lesions. It allows for better visualization of the distinct dark brown to black spots  their margins  and any surrounding yellowish halos on both leaves and glumes. This closer inspection aids in confirming the presence of the disease and differentiating it from other less defined discolorations  especially in the early stages of infection.
Brown spot Grain,Symptoms,Do infected grains fall off early?,Yes  severely infected grains can fall off early  leading to premature shattering. The brown spot fungus causes damage to the pedicel (the stalk supporting the grain) and the glumes  weakening the attachment of the grain to the panicle. This weakening  especially when combined with wind or rain  can result in grains detaching and falling before physiological maturity  contributing to significant yield loss before harvest.
Brown spot Grain,Symptoms,Does brown spot cause poor grain filling?,Yes  brown spot is a significant cause of poor grain filling. The fungus directly infects the glumes and can penetrate the developing kernel. This infection interferes with the physiological processes of the grain  hindering the accumulation of starches and other nutrients. Consequently  the grains become shriveled  lighter in weight  and appear poorly developed  directly impacting both the quantity and quality of the harvest.
Brown spot Grain,Symptoms,What leaf symptoms accompany grain infection?,Leaf symptoms accompanying grain infection of brown spot are distinct and often appear earlier than grain symptoms. These include numerous small  oval to circular spots  typically dark brown with a distinct yellowish halo  scattered across the leaf blade. As the disease progresses  these spots can enlarge  coalesce  and cause severe blighting or drying of the leaves. The presence of these characteristic leaf lesions is a strong indicator of brown spot and potential grain infection.
Brown spot Grain,Symptoms,How do the spots on rice husks look under sunlight?,Under sunlight  the spots on rice husks (glumes) affected by brown spot appear as dark brown to black  often somewhat dull or sunken lesions. The contrast with healthy  typically lighter-colored glumes becomes very evident. In some cases  a subtle reddish-brown tint might be visible in early lesions  but they quickly darken. The sunlight can sometimes highlight the slightly roughened texture of the infected tissue  making the lesions stand out clearly.
Brown spot Grain,Symptoms,Is there any difference in symptoms between BRRI Dhan 50 and BRRI Dhan 63?,While both BRRI Dhan 50 and BRRI Dhan 63 can be affected by brown spot  there might be subtle differences in symptom expression due to varying genetic resistances or susceptibilities. For instance  one variety might show smaller  more scattered spots  while the other might exhibit larger  coalescing lesions under similar infection pressure. The speed of disease progression or the intensity of discoloration could also differ. However  the fundamental characteristics of dark brown spots remain consistent for both.
Brown spot Grain,Symptoms,Do grains infected with brown spot look similar after milling?,No  grains infected with brown spot generally do not look similar after milling compared to healthy grains. Infected grains often exhibit discoloration of the kernel beneath the glumes  appearing brownish or grayish. They are also typically shriveled  smaller  and more brittle  leading to a higher percentage of broken grains during the milling process. This results in a lower milling recovery rate and a reduced quality product compared to uninfected  intact grains.
Brown spot Grain,Symptoms,How can I confirm brown spot without a lab test?,You can confirm brown spot without a lab test through careful visual inspection and knowledge of its characteristic symptoms. Look for: 1. Dark brown to black  oval to circular spots on leaves with yellowish halos. 2. Similar dark brown spots on the glumes (outer covering) of the developing grains. 3. Poorly filled  shriveled  or lighter grains. 4. Presence of the disease increasing with high humidity or nutrient deficiencies. Observing these combined symptoms strongly indicates brown spot  especially if leaf and grain symptoms appear concurrently.
Brown spot Grain,Symptoms,Do infected grains germinate properly?,No  infected grains typically do not germinate properly. Seeds carrying the brown spot fungus (*Bipolaris oryzae*) have significantly reduced germination rates. The pathogen can cause seedling blight  leading to weak  stunted  or completely failed germination. Even if they germinate  the seedlings are often less vigorous and serve as a source of inoculum for further disease spread  making seed treatment crucial for prevention.
Brown spot Grain,Symptoms,Does brown spot affect rice aroma or taste?,Yes  brown spot can indirectly affect rice aroma and taste  though this is not a primary symptom. Severe infection leading to poor grain filling  shriveling  and discoloration can result in grains with altered chemical compositions. This can potentially lead to a less desirable or off-flavor in cooked rice  and may also impact the natural aroma profile. However  the effect on taste and aroma is generally a consequence of severe quality degradation rather than a direct aromatic compound produced by the fungus.
Brown spot Grain,Symptoms,Are the infected grains lighter in weight?,Yes  infected grains are typically lighter in weight. The brown spot fungus interferes with the normal development and filling of the rice kernel. This disruption in nutrient accumulation results in shriveled and poorly formed grains that have a lower density and consequently weigh less than healthy  fully developed grains. This reduction in individual grain weight contributes significantly to overall yield loss.
Brown spot Grain,Symptoms,Do brown spot lesions spread during grain storage?,Brown spot lesions can potentially continue to develop or spread during grain storage if the storage conditions are not optimal  particularly if moisture content is high. While the most active phase of infection occurs in the field  spores can survive on grains  and if humidity and temperature inside the storage facility are conducive  the fungus can become active  leading to further deterioration and increased spoilage of the stored rice. Proper drying and controlled storage are essential to halt this.
Brown spot Grain,Symptoms,Can brown spot be mistaken for false smut?,Yes  brown spot can potentially be mistaken for false smut by an untrained eye  but they have distinct differences. Brown spot causes dark brown to black spots on glumes and leaves. False smut  however  is characterized by large  spherical  powdery  greenish-yellow to olive-green spore balls that replace individual grains within the panicle. These 'smut balls' are much more prominent and distinctly colored compared to the flat  dark lesions of brown spot.
Brown spot Grain,Symptoms,Is there a difference in grain color between mild and severe infections?,Yes  there is a clear difference in grain color between mild and severe brown spot infections. In mild infections  grains exhibit scattered  small  dark brown spots on the glumes. The overall grain color largely remains close to normal. In severe infections  these spots enlarge  coalesce  and cover most of the glume surface  turning the grains intensely dark brown or black  often with a dull  shriveled appearance. The visual impact is much more pronounced with severe infection.
Brown spot Grain,Symptoms,Do infected grains show uneven ripening?,Yes  infected grains can show uneven ripening. When brown spot severely infects a panicle  the affected grains or portions of the panicle may mature slower or faster  or simply fail to ripen properly compared to healthy grains. This uneven ripening can make harvesting challenging and further reduce overall grain quality  as some grains might be immature while others are over-ripe or already damaged.
Brown spot Grain,Symptoms,How long does it take for brown spot symptoms to appear after infection?,The time it takes for brown spot symptoms to appear after infection can vary  but typically it ranges from 4 to 7 days under favorable environmental conditions (high humidity  moderate temperatures). Spores germinate quickly  and the fungus penetrates the plant tissue. Visible lesions on leaves or glumes will then become apparent within this timeframe  allowing for relatively rapid detection following a conducive weather event.
Brown spot Grain,Symptoms,Does humidity increase the visibility of symptoms?,Yes  humidity significantly increases the visibility and severity of brown spot symptoms. High humidity provides the ideal moist environment for fungal spore germination and infection. Under such conditions  lesions develop faster  become larger  and the discoloration appears more pronounced and darker. The fungus thrives in moist conditions  leading to a more aggressive expression of the disease on both leaves and grains.
Brown spot Grain,Symptoms,Can brown spot be seen during flowering stage?,Yes  brown spot can certainly be seen during the flowering stage  though symptoms on the grains themselves might be subtle initially. Leaf symptoms (dark brown spots) would be quite visible if present. On the panicles  early infections might manifest as small  dark spots on the glumes of newly formed florets or very young grains. Detecting it at this stage is crucial for timely intervention to protect the developing grains.
Brown spot Grain,Symptoms,Are the brown patches smooth or rough to touch?,The brown patches caused by brown spot disease on rice grains are generally not distinctly rough or smooth to touch in a tactile sense. They are typically discolored  sunken lesions on the glumes. The texture is more of a visual impression of damaged  often shriveled tissue rather than a pronounced tactile difference. However  severely infected  shriveled grains might feel slightly harder or more brittle than healthy  plump grains.
Brown spot Grain,Symptoms,Does brown spot affect grain size?,Yes  brown spot significantly affects grain size. The fungal infection disrupts the normal development and filling of the rice kernel. This interference with nutrient uptake and carbohydrate accumulation leads to the production of smaller  shriveled  and underdeveloped grains. Ultimately  brown spot reduces the overall physical size and plumpness of the individual rice grains.
Brown spot Grain,Symptoms,Can brown spot be seen under normal field light?,Yes  brown spot can be readily seen under normal field light. The dark brown to black lesions on the leaves and especially on the glumes of the rice grains are distinct enough to be observed with the naked eye. While a magnifying glass helps with detailed inspection  the characteristic discoloration and spotting are generally quite visible under ambient daylight conditions  allowing for field diagnosis.
Brown spot Grain,Symptoms,Are the lesions on grains uniform in all areas?,No  the lesions on grains are generally not uniform in all areas of the panicle or even on individual grains. Infection can occur randomly  leading to scattered spots initially. As the disease progresses  some grains might be more severely infected than others  resulting in varying sizes and intensity of lesions. Environmental factors and the timing of spore deposition can also lead to non-uniform lesion development across the panicle.
Brown spot Grain,Symptoms,Do infected grains float in water?,Severely infected and poorly filled grains due to brown spot are more likely to float in water during a simple buoyancy test. Healthy  well-filled rice grains are dense and typically sink. However  shriveled  lightweight grains resulting from brown spot infection have reduced density and increased air spaces  causing them to float. This can be a useful  albeit simple  indicator of severe infection and poor quality.
Brown spot Grain,Symptoms,Can brown spot symptoms appear during drying?,Brown spot symptoms typically manifest *before* drying  during the grain filling and ripening stages in the field. However  if grains with latent infections or residual fungal spores are not dried properly (i.e.  remain at high moisture content)  the fungus can continue to develop or reactivate during storage. This post-harvest fungal growth might worsen existing discoloration or lead to new spoilage  which could be perceived as appearing during drying if drying is inadequate.
Brown spot Grain,Symptoms,Do grains with brown spot have black tips?,Not necessarily. While brown spot causes dark brown to black lesions  these spots can appear anywhere on the glumes of the rice grain  not exclusively at the tips. The lesions are usually scattered or coalesce into irregular patches. Other issues like glume blight or certain physiological disorders might cause specific blackening of the tips. For brown spot  the dark lesions are more generalized across the grain surface.
Brown spot Grain,Symptoms,Does brown spot cause chalky grains?,Brown spot can indirectly contribute to chalky grains. Severe fungal infection disrupts the normal development and starch accumulation within the rice kernel. This impairment can lead to grains with a less translucent  more opaque  or chalky appearance. While brown spot directly causes discoloration and poor filling  the physiological stress it induces can result in chalkiness  which further degrades the milling quality and market value of the rice.
Brown spot Grain,Symptoms,Do infected grains have lower market value?,Yes  infected grains have a significantly lower market value. The discoloration  shriveling  brittleness  and poor milling quality caused by brown spot make the rice aesthetically unappealing and functionally inferior. Buyers often reject severely infected batches or offer a much reduced price due to the poor appearance  lower head rice yield  and potential for reduced shelf life. This leads to substantial economic losses for farmers.
Brown spot Grain,Symptoms,Are the grains brittle after infection?,Yes  the grains become brittle after brown spot infection. The fungus damages the internal structure of the developing kernel  leading to poor filling and shriveling. This compromises the grain's integrity  making it more fragile and prone to breakage during harvesting  drying  and especially during the milling process. Increased brittleness results in a higher percentage of broken rice  significantly lowering its market quality.
Brown spot Grain,Symptoms,Do the lesions form rings or solid patches?,On rice grains  brown spot lesions typically form solid patches rather than distinct rings. While individual spots might be circular or oval initially  they tend to enlarge and coalesce to form irregular  solid dark brown to black patches covering portions or even most of the glume surface. Ring-like lesions are less characteristic of brown spot on grains  though a yellowish halo can sometimes surround individual spots.
Brown spot Grain,Symptoms,Do infected panicles show any browning?,Yes  severely infected panicles can show browning  beyond just the individual grains. If brown spot infection is widespread and severe on the panicle branches and rachis (the main axis of the panicle)  these structures can also develop lesions and eventually turn brown or necrotic. This browning contributes to premature drying and shattering of the entire panicle or significant portions of it  further impacting yield.
Brown spot Grain,Symptoms,How do early and late infections differ in appearance?,Early brown spot infections on grains typically appear as small  scattered  dark brown pinpoint spots on the glumes. The grains might still appear relatively plump. Late infections  however  exhibit larger  often coalescing  intensely dark brown to black patches covering significant portions of the glumes. Grains from late infections are usually shriveled  lighter  and show more severe internal discoloration  indicating extensive damage.
Brown spot Grain,Symptoms,Can brown spot symptoms appear after threshing?,Brown spot symptoms primarily develop *before* threshing  on the maturing grains in the field. However  if threshing occurs with grains that have latent infections or are not properly cleaned and dried  the fungus can potentially continue to proliferate during storage if conditions are favorable (high moisture). This might lead to the worsening of existing symptoms or the development of new spoilage after threshing  especially during inadequate storage.
Brown spot Grain,Symptoms,Does the disease spread to stored rice grains?,The brown spot fungus (*Bipolaris oryzae*) can survive on harvested grains. While active disease progression largely occurs in the field  if stored rice grains are not adequately dried and maintained at low moisture content  the fungus can remain viable. Under high humidity or moisture conditions in storage  it can cause further deterioration  discoloration  and spoilage of stored rice  leading to reduced quality and economic losses.
Brown spot Grain,Symptoms,Do affected grains lose luster?,Yes  affected grains often lose their natural luster. Healthy rice grains  particularly on the glumes  possess a certain sheen. Brown spot lesions  being dark  dry  and often sunken  cause the infected areas to appear dull  discolored  and lacking the healthy  vibrant luster of uninfected grains. This dullness contributes to the overall reduction in aesthetic quality and market appeal.
Brown spot Grain,Symptoms,Do infected grains break easily during milling?,Yes  infected grains break easily during milling. Brown spot causes poor grain filling  leading to shriveled  brittle  and structurally weakened kernels. These compromised grains cannot withstand the mechanical stress of milling as effectively as healthy  plump grains. Consequently  there is a significantly higher percentage of broken rice  which reduces the head rice yield and the overall market value of the milled product.
