Diseases name,Category,Question,Answer
Brown spot Grain,Treatment,Can solarization be used in rice nurseries to prevent it?,Yes  solarization can be a useful method in rice nurseries to prevent brown spot. Soil solarization  involving covering moist soil with transparent polyethylene sheets for several weeks during hot periods  increases soil temperature to levels lethal to many soil-borne pathogens  including *Bipolaris oryzae* spores and infected residues. This helps create a pathogen-free environment for healthy seedling development  reducing initial inoculum.
Brown spot Grain,Treatment,Can spraying potassium silicate help reduce brown spot?,Yes  spraying potassium silicate can significantly help reduce brown spot. Silicon is known to enhance the structural strength of rice plant cell walls  forming a physical barrier that makes it more difficult for the *Bipolaris oryzae* fungus to penetrate and infect. It also boosts the plant's natural defense mechanisms  making it more resistant to disease. Foliar application provides direct uptake to leaves and panicles.
Brown spot Grain,Treatment,Are biological seed treatments more sustainable for control?,Yes  biological seed treatments are generally more sustainable for brown spot control compared to conventional chemical treatments. They use beneficial microorganisms that provide protective effects without leaving chemical residues  thereby minimizing environmental impact. They promote soil health and can be integrated into organic and low-input farming systems  offering a more environmentally friendly approach to initial disease prevention and seedling protection.
Brown spot Grain,Treatment,Should I consult an extension officer before choosing fungicide?,Yes  absolutely. You should always consult an agricultural extension officer or a qualified plant pathologist before choosing a fungicide for brown spot. They can provide up-to-date information on: 1. The most effective and locally recommended fungicides. 2. Proper application rates and timings. 3. Strategies to prevent fungicide resistance. 4. Integrated management approaches tailored to your specific field conditions and regional disease pressure.
Brown spot Grain,Prevention,What are the best cultural practices to prevent brown spot in rice?,The best cultural practices to prevent brown spot in rice include: using resistant varieties  planting certified disease-free seeds  maintaining balanced soil fertility (especially adequate potassium and silicon)  managing irrigation to avoid prolonged leaf wetness  proper field sanitation (removing infected residues)  and practicing crop rotation. These measures collectively reduce inoculum load  strengthen plants  and create an unfavorable environment for the pathogen.
Brown spot Grain,Prevention,Can crop rotation reduce brown spot risk?,Yes  crop rotation is a highly effective cultural practice to reduce brown spot risk. Since the brown spot fungus (*Bipolaris oryzae*) survives in rice crop residues  rotating rice with non-host crops (e.g.  legumes or other upland crops) breaks the disease cycle. This reduces the inoculum buildup in the soil over time  significantly lowering the pathogen pressure and preventing severe outbreaks in subsequent rice crops.
Brown spot Grain,Prevention,Does using certified seeds prevent brown spot disease?,Yes  using certified  disease-free seeds is a fundamental and highly effective way to prevent brown spot disease. The brown spot fungus is seed-borne  meaning it can be carried on or within the rice seeds. Certified seeds undergo testing and treatment to ensure they are free from pathogens  thereby eliminating a primary source of inoculum and protecting seedlings from early infection.
Brown spot Grain,Prevention,How important is seed drying before sowing for brown spot prevention?,Seed drying before sowing is crucial for brown spot prevention  especially if seeds were not certified or treated. While primarily aimed at safe storage  ensuring seeds are properly dried to a safe moisture content inhibits any potential fungal growth on the seed surface or within the seed during storage. For prevention  however  seed treatment with fungicides is even more direct and effective against seed-borne inoculum.
Brown spot Grain,Prevention,Can balanced fertilization help prevent brown spot?,Yes  balanced fertilization is a key preventive measure against brown spot. Rice plants receiving optimal and balanced nutrients (N  P  K  and micronutrients like silicon) are healthier and more vigorous. This strengthens their natural defense mechanisms and improves their resistance to *Bipolaris oryzae* infection  making them less susceptible to the disease and reducing its severity.
Brown spot Grain,Prevention,Is early planting useful to avoid brown spot infection?,Early planting can be useful to avoid brown spot infection if it allows the critical growth stages of rice (especially flowering and grain filling) to occur during periods that are less favorable for disease development. For example  if early planting ensures maturity before the onset of prolonged high humidity and rainfall that typically favors brown spot  it can significantly reduce infection risk.
Brown spot Grain,Prevention,Can maintaining proper water levels prevent the disease?,Maintaining proper water levels is important for overall plant health  which indirectly helps prevent brown spot. While brown spot thrives in humid conditions  good water management (avoiding both extreme drought stress and prolonged waterlogging) ensures plants are not stressed. Also  carefully managing water to minimize prolonged leaf wetness can reduce the conducive environment for fungal spore germination and infection.
Brown spot Grain,Prevention,Does removing infected residues help prevent brown spot?,Yes  removing infected residues is a highly effective cultural practice for brown spot prevention. The fungus *Bipolaris oryzae* survives in rice crop residues (straw  stubble) after harvest. By removing or thoroughly burying these residues  the primary inoculum source for the next season's crop is eliminated or significantly reduced  thereby breaking the disease cycle and lowering infection risk.
Brown spot Grain,Prevention,Should I disinfect seedbeds before planting?,Yes  disinfecting seedbeds before planting is an excellent preventative measure for brown spot  particularly in nurseries. Methods like solarization (covering with plastic sheets to heat the soil) or using approved soil sterilants can kill *Bipolaris oryzae* spores and other pathogens present in the soil. This ensures a clean environment for healthy seedling growth  reducing the initial spread of the disease to the main field.
Brown spot Grain,Prevention,Can field sanitation prevent brown spot outbreaks?,Yes  field sanitation is a crucial practice to prevent brown spot outbreaks. This involves removing or deeply incorporating infected crop residues after harvest  destroying weeds that might harbor the pathogen  and maintaining a clean field environment. By reducing the inoculum sources  field sanitation significantly lowers the initial disease pressure  thereby preventing widespread outbreaks in subsequent crops.
Brown spot Grain,Prevention,Does proper spacing between rice plants reduce infection?,Yes  proper spacing between rice plants can help reduce brown spot infection. Adequate spacing improves air circulation within the crop canopy  which helps in faster drying of leaves and glumes after rain or dew. This reduction in prolonged leaf wetness creates a less favorable microclimate for the germination and spread of *Bipolaris oryzae* spores  thus minimizing infection risk and disease severity.
Brown spot Grain,Prevention,Can applying compost improve resistance to brown spot?,Yes  applying compost can significantly improve rice plants' resistance to brown spot. Compost enhances soil fertility  improves soil structure  and promotes a healthy microbial community. This leads to more vigorous  nutrient-rich plants with stronger natural defense mechanisms. Healthier plants are inherently more resilient and less susceptible to *Bipolaris oryzae* infection  thus reducing brown spot incidence and severity.
Brown spot Grain,Prevention,Should I test soil before the season to prevent disease?,Yes  testing soil before the season is a highly recommended preventive measure for brown spot. Soil tests reveal nutrient deficiencies (especially potassium and silicon) and pH imbalances that can weaken rice plants and increase their susceptibility. Addressing these issues through targeted fertilization and lime application creates healthier plants with improved natural resistance  thus preventing brown spot outbreaks related to soil health.
Brown spot Grain,Prevention,Does weed control help in preventing brown spot?,Yes  weed control helps in preventing brown spot. Dense weed populations compete with rice plants for essential nutrients  water  and sunlight  stressing the rice crop. Stressed plants are more susceptible to brown spot infection. Additionally  some weeds might potentially act as alternative hosts or create a humid microclimate conducive to pathogen growth. Therefore  effective weed management promotes healthier  more resistant rice.
Brown spot Grain,Prevention,Can crop residue burning prevent brown spot spread?,Crop residue burning can prevent brown spot spread by eliminating a significant portion of *Bipolaris oryzae* spores and infected residues from the field surface. This reduces the primary inoculum source for the next season. However  field burning has environmental drawbacks (air pollution  loss of soil organic matter and beneficial microbes) and its efficacy can vary  leading many to prefer residue incorporation or other methods.
Brown spot Grain,Prevention,Is drainage management important for disease prevention?,Yes  drainage management is important for brown spot disease prevention. While brown spot thrives in humid conditions  excessively poor drainage leading to prolonged waterlogging can stress rice plants  impairing root health and nutrient uptake. Stressed plants are more vulnerable. Conversely  good drainage  combined with appropriate irrigation  helps regulate soil moisture  ensures plant vigor  and prevents conditions conducive to pathogen buildup.
Brown spot Grain,Prevention,Does maintaining soil pH help reduce brown spot?,Yes  maintaining optimal soil pH helps reduce brown spot. Brown spot is often more severe in acidic soils  which can lead to nutrient deficiencies (e.g.  potassium  silicon) that weaken rice plants. By adjusting and maintaining soil pH within the optimal range for rice (around 5.5-7.0)  nutrient availability is maximized  plants become healthier and more vigorous  thereby enhancing their natural resistance to *Bipolaris oryzae*.
Brown spot Grain,Prevention,Can alternating wet and dry irrigation cycles prevent brown spot?,Alternating wet and dry irrigation cycles (AWD) can indirectly help prevent brown spot. While the fungus thrives in humidity  AWD reduces prolonged periods of continuous standing water  which can contribute to excessive canopy humidity and also minimize plant stress. By optimizing water use and ensuring good soil aeration  plants remain healthier and more robust  thereby enhancing their natural resistance to *Bipolaris oryzae*.
Brown spot Grain,Prevention,Does using resistant rice varieties prevent brown spot naturally?,Yes  using resistant rice varieties is one of the most effective and natural ways to prevent brown spot. These varieties possess genetic traits that enable them to either tolerate the infection or resist the pathogen (*Bipolaris oryzae*) more effectively than susceptible varieties. This inherent resistance reduces disease incidence and severity  minimizing the need for chemical interventions.
Brown spot Grain,Prevention,Should I avoid continuous rice cropping to prevent the disease?,Yes  you should definitely avoid continuous rice cropping to prevent brown spot disease. Continuous rice cultivation allows the brown spot pathogen (*Bipolaris oryzae*) to accumulate in the soil via crop residues  ensuring a high inoculum load for subsequent crops. Practicing crop rotation with non-host plants effectively breaks this disease cycle  reducing pathogen survival and preventing severe outbreaks.
Brown spot Grain,Prevention,Can applying organic matter reduce brown spot risk?,Yes  applying organic matter (e.g.  compost  farmyard manure) can significantly reduce brown spot risk. Organic matter improves soil health by enhancing structure  water retention  and nutrient availability  and by fostering a diverse microbial community. This leads to healthier  more vigorous rice plants with stronger natural defenses  making them less susceptible to *Bipolaris oryzae* infection and disease development.
Brown spot Grain,Prevention,Is potassium fertilization effective for disease prevention?,Yes  potassium fertilization is highly effective for brown spot disease prevention. Potassium is a crucial nutrient that strengthens plant cell walls  improves water use efficiency  and enhances overall plant immunity and stress resistance. Rice plants with adequate potassium are much more resilient and less susceptible to *Bipolaris oryzae* infection  leading to reduced disease incidence and severity.
Brown spot Grain,Prevention,Does mulching prevent disease development?,Mulching can indirectly help prevent brown spot disease development. Organic mulches can help regulate soil moisture and temperature  potentially reducing plant stress. It can also suppress weed growth  which otherwise would compete with rice plants. By promoting healthier plant growth and potentially altering the microclimate slightly (e.g.  reducing soil splash that carries spores)  mulching can contribute to a less favorable environment for brown spot.
Brown spot Grain,Prevention,Should I use fungicide seed treatment for prevention?,Yes  using fungicide seed treatment is a highly recommended and effective preventive measure for brown spot. Since the brown spot fungus (*Bipolaris oryzae*) is seed-borne  treating seeds with appropriate fungicides eliminates or significantly reduces the primary inoculum source. This protects seedlings from early infection and prevents the initial establishment and spread of the disease in the field.
Brown spot Grain,Prevention,Can good nursery management stop brown spot early?,Yes  good nursery management is crucial for stopping brown spot early and preventing its spread to the main field. Practices like using disease-free seeds  disinfecting seedbeds  ensuring proper spacing for air circulation  and maintaining balanced nutrition in the nursery create healthy  vigorous seedlings. This early prevention reduces the likelihood of brown spot establishing and becoming a major problem later in the main crop.
Brown spot Grain,Prevention,Does cleaning farm tools reduce infection risk?,Cleaning farm tools can help reduce the infection risk of brown spot  though it's not a primary mode of spread. Fungal spores or infected plant debris might adhere to tools  and if these tools are moved between fields or parts of a field  they could potentially transfer inoculum. Disinfecting tools  especially when moving from an infected area to a healthy one  is a good general hygiene practice to minimize pathogen dispersal.
Brown spot Grain,Prevention,Can sunlight exposure of seedbeds prevent fungus growth?,Yes  sunlight exposure of seedbeds can help prevent fungus growth  particularly if combined with practices like solarization. Direct sunlight  especially UV radiation  has fungicidal properties. Good sunlight exposure on seedbeds helps dry out the soil surface and seedling leaves more quickly  creating a less humid and less favorable environment for the germination and growth of brown spot fungus and other pathogens.
Brown spot Grain,Prevention,Should I apply lime to prevent soil-borne infection?,Applying lime can help prevent soil-borne infections  including those potentially contributing to brown spot  particularly in acidic soils. Brown spot is often more severe in low pH soils where nutrient deficiencies weaken plants. Liming raises soil pH  improving nutrient availability (e.g.  potassium  silicon) and promoting overall plant health. This enhances the plant's natural resistance  thereby reducing its susceptibility to *Bipolaris oryzae*.
Brown spot Grain,Prevention,Does maintaining nitrogen balance prevent disease?,Yes  maintaining nitrogen balance is important to prevent brown spot disease. While nitrogen is essential  excessive nitrogen fertilization can lead to lush  succulent growth  making plants softer and more vulnerable to fungal infections. Conversely  severe nitrogen deficiency can stress plants. A balanced nitrogen application  along with other nutrients  promotes healthy  robust plants with better disease resistance.
Brown spot Grain,Prevention,Can early weeding help avoid brown spot spread?,Yes  early weeding can help avoid brown spot spread. Weeds compete with rice plants for resources  stressing the crop and making it more susceptible to disease. Additionally  dense weed cover can create a humid microclimate within the canopy  favoring fungal growth and spread. By removing weeds early  rice plants are healthier and the environment is less conducive to brown spot development.
Brown spot Grain,Prevention,Is irrigation with clean water important to prevent brown spot?,While less direct than other measures  using clean irrigation water is important for overall rice plant health  which indirectly contributes to brown spot prevention. Contaminated water could potentially introduce other stressors or pathogens. Ensuring good water quality contributes to a healthier  more vigorous crop that is better equipped to resist *Bipolaris oryzae* infection. However  airborne spores are the main source  not typically water-borne.
Brown spot Grain,Prevention,Can maintaining air circulation between plants help?,Yes  maintaining good air circulation between rice plants is a crucial preventive measure against brown spot. Adequate spacing and proper canopy management allow air to move freely  which helps dry out leaf and panicle surfaces more quickly after rain or dew. This reduces prolonged leaf wetness  creating a less humid microclimate that is unfavorable for the germination and infection of *Bipolaris oryzae* spores.
Brown spot Grain,Prevention,Should I monitor weather patterns to prevent brown spot outbreaks?,Yes  you should absolutely monitor weather patterns to prevent brown spot outbreaks. Brown spot thrives in specific conditions: prolonged high humidity  frequent rainfall  and warm temperatures. By tracking forecasts  farmers can anticipate conducive periods for disease development and implement timely preventive measures  such as adjusting irrigation  applying protective fungicides  or intensifying field scouting  before a widespread outbreak occurs.
Brown spot Grain,Prevention,Can using microbial biofertilizers prevent infection?,Yes  using microbial biofertilizers can help prevent brown spot infection. Biofertilizers enhance soil health  improve nutrient uptake  and often contain beneficial microorganisms that can act as antagonists to plant pathogens. By promoting stronger  healthier plants and potentially suppressing *Bipolaris oryzae* in the soil or rhizosphere  biofertilizers contribute to increased plant resistance and reduced disease incidence.
Brown spot Grain,Prevention,Does crop residue incorporation increase or decrease disease?,Crop residue incorporation generally decreases brown spot disease by promoting the decomposition of infected residues. When residues are plowed under  the *Bipolaris oryzae* fungus is exposed to antagonistic soil microbes and conditions less favorable for its survival  thus reducing the primary inoculum source. This is generally preferred over surface residues or burning  which can release spores or damage soil health.
Brown spot Grain,Prevention,Should I rotate with legumes to prevent brown spot?,Yes  rotating rice with legumes is an excellent strategy to prevent brown spot. Legumes are non-host crops for *Bipolaris oryzae*  so their cultivation breaks the disease cycle by depriving the fungus of its host. Additionally  legumes fix atmospheric nitrogen  improving soil fertility  which leads to healthier rice plants with enhanced resistance to brown spot when rice is subsequently planted.
Brown spot Grain,Prevention,Can regular field inspections prevent severe infection?,Yes  regular field inspections are crucial for preventing severe brown spot infection. Early detection of symptoms on leaves or developing grains allows for timely intervention. By identifying the disease in its initial stages  farmers can implement targeted management strategies (e.g.  fungicide application  nutrient adjustment) before the infection becomes widespread and causes significant damage  thus preventing severe outbreaks.
Brown spot Grain,Prevention,Does removing alternate host plants help control disease?,While *Bipolaris oryzae* is primarily a pathogen of rice  some grass weeds can potentially act as minor alternate hosts. Removing these alternate host plants and weeds reduces potential reservoirs of the pathogen and eliminates competition for resources  thereby promoting healthier rice plants that are more resistant to brown spot. So  yes  it contributes to overall disease control.
Brown spot Grain,Prevention,Should I apply foliar micronutrients to prevent brown spot?,Yes  applying foliar micronutrients  especially silicon  can be a beneficial preventive measure for brown spot. Silicon strengthens the cell walls of rice plants  creating a physical barrier against fungal penetration. Other balanced micronutrients also ensure the plant's overall health and vigor  bolstering its natural defense mechanisms against *Bipolaris oryzae* infection and reducing disease susceptibility.
Brown spot Grain,Prevention,Can farmyard manure improve soil health and prevent brown spot?,Yes  farmyard manure (FYM) can significantly improve soil health and thereby help prevent brown spot. FYM enriches the soil with organic matter and nutrients  improving soil structure  water retention  and microbial activity. This leads to healthier  more vigorous rice plants with enhanced natural resistance to *Bipolaris oryzae* infection  reducing the incidence and severity of the disease.
Brown spot Grain,Prevention,Does controlled irrigation help prevent fungal development?,Yes  controlled irrigation is crucial for preventing fungal development of brown spot. Avoiding prolonged periods of leaf wetness and excessively high humidity within the crop canopy is key. By irrigating judiciously  especially in the mornings  and ensuring good drainage  the environment becomes less favorable for the germination  growth  and spread of *Bipolaris oryzae* spores  thereby curbing fungal development.
Brown spot Grain,Prevention,Can maintaining good drainage reduce brown spot pressure?,Yes  maintaining good drainage can reduce brown spot pressure. While brown spot thrives in humidity  poor drainage leading to waterlogging can stress rice plants by impairing root health and nutrient uptake. Stressed plants are more susceptible to disease. Good drainage ensures a healthy root system  promotes overall plant vigor  and helps avoid conditions that favor pathogen proliferation.
Brown spot Grain,Prevention,Should I avoid over-fertilization to prevent brown spot?,Yes  you should avoid over-fertilization  especially with nitrogen  to prevent brown spot. Excessive nitrogen can lead to lush  soft  vegetative growth  making rice plants more susceptible to fungal diseases like brown spot. It can also disrupt the balance of other essential nutrients. A balanced fertilization regime that avoids nutrient excesses or deficiencies promotes healthier  more resistant plants.
Brown spot Grain,Prevention,Is there a community-level approach to prevent brown spot spread?,Yes  a community-level approach is highly effective in preventing brown spot spread. This involves coordinated efforts across farms  such as synchronized planting and harvesting  regional crop rotation plans  widespread use of resistant varieties  and collective field sanitation. When an entire community adopts these practices  the overall inoculum load is reduced  benefiting all farmers and minimizing regional disease pressure.
Brown spot Grain,Prevention,Can solar drying of seeds before storage help prevent disease?,Yes  solar drying of seeds before storage can help prevent disease  including brown spot  by reducing moisture content to safe levels. The heat from solar drying can also directly kill some surface-borne pathogens. This process is crucial because the *Bipolaris oryzae* fungus requires moisture to remain viable and cause spoilage in stored seeds. Proper drying ensures pathogen dormancy.
Brown spot Grain,Prevention,Does applying silicon fertilizer prevent brown spot infection?,Yes  applying silicon fertilizer is an effective preventive measure against brown spot infection. Silicon strengthens the cell walls of rice plants  creating a physical barrier that makes it more difficult for the Bipolaris oryzae fungus to penetrate and infect. It also enhances the plant's natural defense mechanisms and improves its overall resilience  thereby significantly reducing the incidence and severity of brown spot disease.
